{
  "run_id": "benchmark_impossible_goal_20260506091200",
  "step_id": 1,
  "status": "PASSED",
  "action_taken": "create_file",
  "files_touched": [
    "impossible.txt"
  ],
  "commands_run": [
    "write impossible.txt"
  ],
  "evidence": [
    "Created file impossible.txt"
  ],
  "pass_condition_satisfied": true,
  "remaining_work": []
}