{
  "run_id": "golden_strict_p2_minimal",
  "step_id": 4,
  "status": "PASSED",
  "action_taken": "create_file",
  "files_touched": [
    "README.md"
  ],
  "commands_run": [
    "write README.md"
  ],
  "evidence": [
    "Created file README.md"
  ],
  "pass_condition_satisfied": true,
  "remaining_work": []
}
