{
  "run_id": "he_full",
  "step_id": 1,
  "status": "PASSED",
  "action_taken": "create_file",
  "files_touched": [
    "find_closest_elements.py",
    "test_find_closest_elements.py"
  ],
  "commands_run": [
    "write find_closest_elements.py",
    "write test_find_closest_elements.py",
    "write step_logs/1.json"
  ],
  "evidence": [
    "Created find_closest_elements.py with sort-then-scan implementation of find_closest_elements function supporting ValueError for len<2, sorted copy, adjacent scan, early exit on zero diff, and CLI entry point",
    "Created test_find_closest_elements.py with unittest test cases covering example cases, duplicate values, unsorted input, invalid input (ValueError), and float precision"
  ],
  "pass_condition_satisfied": true,
  "remaining_work": []
}
