{
  "run_id": "iter_test",
  "step_id": 1,
  "status": "PASSED",
  "action_taken": "create_file",
  "evidence": [
    "Created longest_palindrome.py implementing expand-around-center algorithm"
  ],
  "files_touched": ["longest_palindrome.py"],
  "commands_run": [
    "write .agentic-runs/iter_test/longest_palindrome.py"
  ],
  "pass_condition_satisfied": true,
  "remaining_work": []
}