{
  "run_id": "pi_clean",
  "step_id": 1,
  "status": "PASSED",
  "action_taken": "create_file",
  "commands_run": [
    "python t1_producer.py"
  ],
  "evidence": [
    "Created t1_producer.py",
    "Ran t1_producer.py -> created artifacts/t1_artifact.json with artifact_id=A.SOURCE"
  ],
  "pass_condition_satisfied": true,
  "remaining_work": [],
  "files_touched": [
    "artifacts/t1_artifact.json",
    "artifacts/t2_success.txt",
    "dependency_report.md",
    "generate_report.py",
    "goal_contract.json"
  ]
}