{
  "run_id": "benchmark_hard_goal_20260506091144",
  "step_id": 1,
  "status": "PASSED",
  "action_taken": "create_file",
  "files_touched": [
    "cli_tool.py"
  ],
  "commands_run": [
    "write cli_tool.py"
  ],
  "evidence": [
    "Created file cli_tool.py"
  ],
  "pass_condition_satisfied": true,
  "remaining_work": []
}