{
  "run_id": "fix_orch",
  "step_id": 3,
  "status": "PASSED",
  "action_taken": "fix_orchestrator_args",
  "files_touched": ["orchestrate_pipeline.py"],
  "commands_run": ["write .agentic-runs/fix_orch/orchestrate_pipeline.py"],
  "evidence": [
    "Added Optional import from typing",
    "Modified run_phase() to accept extra_args parameter and append them to subprocess cmd",
    "init_run phase now passes ['--run-id', run_id] as required by its argparse",
    "artifact_linker phase now passes [run_id] (positional arg matching its parser)",
    "task_graph_builder phase now passes [run_id] (positional arg matching its parser)",
    "harness_contract_verifier phase now passes [str(run_dir)] (positional run_dir per sys.argv[1])",
    "harness_signing phase now passes ['keygen', str(run_dir)] (command + run_dir per its protocol)",
    "certify_run phase now passes [str(run_dir)] (positional run_dir per sys.argv[1])",
    "All six phase scripts now receive their required CLI arguments",
    "Read-back confirmed: file exists with 3059 bytes"
  ],
  "pass_condition_satisfied": true,
  "remaining_work": []
}
