{
  "run_id": "he_h129",
  "step_id": 1,
  "status": "PASSED",
  "action_taken": "create_file",
  "files_touched": [
    "minPath.py"
  ],
  "commands_run": [
    "write minPath.py"
  ],
  "evidence": [
    "Created minPath.py with minPath(grid, k) function that implements greedy lexicographically minimal path algorithm, input validation, and helper _get_min_neighbor"
  ],
  "pass_condition_satisfied": true,
  "remaining_work": []
}