{
  "run_id": "sample_run_001",
  "step_id": 1,
  "status": "PASSED",
  "action_taken": "Created README.md explaining the v0.1 harness architecture.",
  "files_touched": [
    "README.md"
  ],
  "commands_run": [
    "python smoke_v01.py"
  ],
  "evidence": [
    "README.md exists.",
    "README.md explains Prompt Compiler, Goal Contract, Guarded Worker, Trace Logger, and Certifier."
  ],
  "pass_condition_satisfied": true,
  "remaining_work": []
}