{
  "run_id": "benchmark_medium_goal_20260506091030",
  "step_id": 1,
  "status": "PASSED",
  "action_taken": "create_file",
  "files_touched": [
    "docs\\examples.md"
  ],
  "commands_run": [
    "write docs\\examples.md"
  ],
  "evidence": [
    "Created file docs\\examples.md"
  ],
  "pass_condition_satisfied": true,
  "remaining_work": []
}