{
  "run_id": "pi_dep",
  "step_id": 1,
  "status": "PASSED",
  "action_taken": "create_file",
  "files_touched": [
    "source.txt"
  ],
  "commands_run": [
    "python create_source.py"
  ],
  "evidence": [
    "Created source.txt containing 'Placeholder content for A.SOURCE.'"
  ],
  "pass_condition_satisfied": true,
  "remaining_work": []
}