{
  "run_id": "swe_flask",
  "step_id": 1,
  "status": "PASSED",
  "action_taken": "create_file",
  "files_touched": [
    "flask_config_patch.diff"
  ],
  "commands_run": [
    "write flask_config_patch.diff"
  ],
  "evidence": [
    "Created patch adding mode parameter to from_file()"
  ],
  "pass_condition_satisfied": true,
  "remaining_work": []
}