{
  "run_id": "he_h95",
  "step_id": 1,
  "status": "PASSED",
  "action_taken": "create_file",
  "files_touched": [
    "check_dict_case.py"
  ],
  "commands_run": [
    "write check_dict_case.py"
  ],
  "evidence": [
    "Created check_dict_case.py"
  ],
  "pass_condition_satisfied": true,
  "remaining_work": []
}