{
  "run_id": "fix_orch",
  "step_id": 1,
  "status": "PASSED",
  "action_taken": "create_file",
  "files_touched": [".agentic-pi/runtime/orchestrate_pipeline.py"],
  "commands_run": ["write .agentic-pi/runtime/orchestrate_pipeline.py"],
  "evidence": ["Created .agentic-pi/runtime/orchestrate_pipeline.py with deterministic orchestrator (6 phases: init_run, artifact_linker, task_graph_builder, harness_contract_verifier, harness_signing, certify_run) using subprocess.run"],
  "pass_condition_satisfied": true,
  "remaining_work": []
}
