{
  "run_id": "qrspi_test",
  "step_id": 1,
  "status": "PASSED",
  "action_taken": "create_file",
  "files_touched": ["is_perfect_square.py"],
  "commands_run": ["write .agentic-runs/qrspi_test/is_perfect_square.py"],
  "evidence": ["Created is_perfect_square.py with is_perfect_square() function using math.isqrt, input validation via #@ Requires annotation, and __main__ demo block that prints 7 lines of output"],
  "pass_condition_satisfied": true,
  "remaining_work": []
}
